ID,Module,Topic,DOK,Difficulty,Question,Answer,Tags
W1-201,Cell Anatomy,Membranous Organelles,1,2,What is rough ER?,A ribosome-studded membrane network that makes and packages proteins.,rough ER
W1-202,Cell Anatomy,Membranous Organelles,1,2,What is smooth ER?,A tubular membrane network without ribosomes that makes lipids and stores calcium.,smooth ER
W1-203,Cell Anatomy,Membranous Organelles,1,2,What is the Golgi apparatus?,"A stack of flattened membrane sacs that sorts, packages, and ships cell products.",Golgi apparatus
W1-204,Cell Anatomy,Membranous Organelles,1,2,What are lysosomes?,Membrane sacs of digestive enzymes that break down worn parts and debris.,lysosomes
W1-205,Cell Anatomy,Membranous Organelles,1,2,What are peroxisomes?,Membrane sacs of enzymes that neutralize toxins and free radicals.,peroxisomes
W1-206,Cell Anatomy,Membranous Organelles,1,2,What are mitochondria?,Double-membraned organelles that produce most of the cell’s ATP.,mitochondria
W1-207,Cell Anatomy,Membranous Organelles,1,2,What are vesicles?,Small membrane sacs that move substances within the cell.,vesicles
W1-208,Cell Anatomy,Non-membranous Organelles,1,2,What are ribosomes?,Tiny particles of RNA and protein that build proteins.,ribosomes
W1-209,Cell Anatomy,Non-membranous Organelles,1,2,Where can ribosomes be located?,Free in the cytosol or attached to rough ER.,ribosomes
W1-210,Cell Anatomy,Non-membranous Organelles,1,2,What is the cytoskeleton?,An internal protein framework that gives the cell shape and allows movement.,cytoskeleton
W1-211,Cell Anatomy,Cytoskeleton,1,2,What are microfilaments?,"The thinnest cytoskeletal fibers, made of actin.",microfilaments
W1-212,Cell Anatomy,Cytoskeleton,1,2,What do microfilaments do?,Support the cell surface and enable movement.,microfilaments
W1-213,Cell Anatomy,Cytoskeleton,1,2,What are intermediate filaments?,Rope-like cytoskeletal fibers that resist pulling forces and give the cell strength.,intermediate filaments
W1-214,Cell Anatomy,Cytoskeleton,1,2,What are microtubules?,The thickest cytoskeletal fibers; hollow tubes that form tracks for transport.,microtubules
W1-215,Cell Anatomy,Cytoskeleton,1,2,What is the centrosome?,A region near the nucleus that organizes microtubules.,centrosome
W1-216,Cell Anatomy,Cytoskeleton,1,2,What are centrioles?,"Paired rod-shaped structures within the centrosome, made of nine microtubule triplets in a 9+0 array.",centrioles
W1-217,Cell Anatomy,Cytoskeleton,1,2,What do centrioles organize during cell division?,The spindle.,centrioles; spindle
W1-218,Cell Anatomy,Endomembrane System,1,2,What is the endomembrane system?,"The connected route of nuclear envelope, ER, Golgi apparatus, vesicles, and lysosomes.",endomembrane system
W1-219,Cell Anatomy,Endomembrane System,1,2,Where does a secreted protein begin its path?,Rough ER.,secreted protein pathway
W1-220,Cell Anatomy,Endomembrane System,1,2,What carries a product from the ER to the Golgi apparatus?,A transport vesicle.,transport vesicle
W1-221,Cell Anatomy,Endomembrane System,1,2,"What organelle sorts, modifies, and packages a product?",Golgi apparatus.,Golgi apparatus
W1-222,Cell Anatomy,Endomembrane System,1,2,What carries a product from the Golgi to the plasma membrane?,A secretory vesicle.,secretory vesicle
W1-223,Cell Anatomy,Endomembrane System,1,2,What is exocytosis?,The exit point where a vesicle fuses with the plasma membrane and releases the product.,exocytosis
W1-224,Cell Anatomy,Endomembrane System,1,2,What is endocytosis?,"The reverse direction, where material is taken into the cell inside a newly formed vesicle.",endocytosis
W1-225,Cell Anatomy,Endomembrane System,1,2,What cytoskeletal structure acts as tracks for vesicles?,Microtubules.,microtubules; vesicles
W1-226,Cell Anatomy,Endomembrane System,1,2,What structure allows mRNA to leave the nucleus?,Nuclear pores.,nuclear pores
W1-227,Cell Anatomy,Organelle Comparison,2,3,Compare rough ER and smooth ER.,Rough ER has ribosomes and makes/packages proteins; smooth ER lacks ribosomes and makes lipids/stores calcium.,rough ER; smooth ER
W1-228,Cell Anatomy,Organelle Comparison,2,3,Compare lysosomes and peroxisomes.,Lysosomes digest worn parts and debris; peroxisomes neutralize toxins and free radicals.,lysosomes; peroxisomes
W1-229,Cell Anatomy,Organelle Comparison,2,3,Compare mitochondria and ribosomes by function.,Mitochondria produce ATP; ribosomes build proteins.,mitochondria; ribosomes
W1-230,Cell Anatomy,Organelle Comparison,2,3,Compare membranous and non-membranous organelles.,Membranous organelles are enclosed by membranes; non-membranous organelles are not membrane-bound.,organelles
W1-231,Cell Anatomy,Cytoskeleton,2,3,"Compare microfilaments, intermediate filaments, and microtubules.",Microfilaments are thinnest and actin-based; intermediate filaments resist tension; microtubules are thick hollow tracks.,cytoskeleton
W1-232,Cell Anatomy,Cytoskeleton,2,3,Why are microtubules important for intracellular transport?,They form tracks that vesicles can follow between organelles.,microtubules; transport
W1-233,Cell Anatomy,Endomembrane System,2,3,Trace a secreted protein through the endomembrane system.,Rough ER → transport vesicle → Golgi apparatus → secretory vesicle → plasma membrane → exocytosis.,secreted protein pathway
W1-234,Cell Anatomy,Endomembrane System,2,3,Why is the Golgi apparatus a mid-path stop?,"It sorts, modifies, and packages products before shipping them onward.",Golgi apparatus
W1-235,Cell Anatomy,Endomembrane System,2,3,How does exocytosis differ from endocytosis?,Exocytosis releases material out of the cell; endocytosis brings material into the cell.,exocytosis; endocytosis
W1-236,Cell Anatomy,Endomembrane System,2,3,Why is the nuclear envelope included in the endomembrane system?,It is continuous with rough ER and participates in membrane-connected traffic.,nuclear envelope; ER
W1-237,Cell Anatomy,Cell Specialization,1,2,How are muscle cells structurally adapted for their job?,They are long and packed with mitochondria.,muscle cell
W1-238,Cell Anatomy,Cell Specialization,1,2,Why do muscle cells need many mitochondria?,"Contraction demands a constant, heavy supply of ATP.",muscle cell; mitochondria
W1-239,Cell Anatomy,Cell Specialization,1,2,How are red blood cells structurally adapted for their job?,They lose their nucleus and organelles.,red blood cell
W1-240,Cell Anatomy,Cell Specialization,1,2,Why does a red blood cell lose its nucleus and organelles?,To free interior space for oxygen-carrying contents.,red blood cell
W1-241,Cell Anatomy,Cell Specialization,1,2,How are white blood cells structurally adapted for their job?,They change shape freely.,white blood cell
W1-242,Cell Anatomy,Cell Specialization,1,2,Why do white blood cells need to change shape?,They can squeeze between cells to reach a site of infection.,white blood cell
W1-243,Cell Anatomy,Clinical Reasoning,3,4,A cell cannot digest worn-out organelles. Which organelle is most likely defective?,Lysosome.,lysosomes; clinical
W1-244,Cell Anatomy,Clinical Reasoning,3,4,A cell cannot neutralize toxins and free radicals well. Which organelle is most likely defective?,Peroxisome.,peroxisomes; clinical
W1-245,Cell Anatomy,Clinical Reasoning,3,4,A cell cannot produce enough ATP for contraction. Which organelle is most directly involved?,Mitochondria.,mitochondria; clinical
W1-246,Cell Anatomy,Clinical Reasoning,3,4,A secreted protein is made but cannot be packaged and shipped correctly. Which organelle is most likely involved?,Golgi apparatus.,Golgi; clinical
W1-247,Cell Anatomy,Clinical Reasoning,3,4,A product cannot move from ER to Golgi. Which structure likely failed?,Transport vesicles or microtubule tracks.,vesicles; microtubules
W1-248,Cell Anatomy,Clinical Reasoning,3,4,Messenger RNA cannot leave the nucleus. Which structure is impaired?,Nuclear pores.,nuclear pores; clinical
W1-249,Cell Anatomy,Clinical Reasoning,3,4,A cell surface loses its fuzzy identity coat. Which membrane component is affected?,Glycocalyx.,glycocalyx; clinical
W1-250,Cell Anatomy,Clinical Reasoning,3,4,A cell specialized for secretion would likely have abundant rough ER and Golgi. Why?,Rough ER makes proteins and Golgi sorts/packages them for export.,secretion; ER; Golgi
W1-251,Cell Anatomy,Clinical Reasoning,3,4,A steroid-producing cell would likely have abundant smooth ER. Why?,Smooth ER makes lipids.,smooth ER; lipids
W1-252,Cell Anatomy,Clinical Reasoning,3,4,A cell with high calcium storage needs would rely heavily on which organelle?,Smooth ER.,smooth ER; calcium
W1-253,Tissues,Origins,1,2,What is a tissue?,A group of cells that share a structure and a job.,tissue
W1-254,Tissues,Germ Layers,1,2,What are the three primary germ layers?,"Ectoderm, mesoderm, and endoderm.",germ layers
W1-255,Tissues,Germ Layers,1,2,What does ectoderm form?,The epidermis of the skin and all nervous tissue.,ectoderm
W1-256,Tissues,Germ Layers,1,2,What does mesoderm form?,"Muscle, bone, cartilage, blood, and most connective tissue.",mesoderm
W1-257,Tissues,Germ Layers,1,2,What does endoderm form?,The epithelial lining of the digestive and respiratory tracts and their glands.,endoderm
W1-258,Tissues,Four Tissue Types,1,2,Name the four basic tissue types.,"Epithelial, connective, muscle, and nervous tissue.",four tissue types
W1-259,Tissues,Four Tissue Types,1,2,What is the primary function of epithelial tissue?,"Covers surfaces, lines cavities and vessels, and forms glands.",epithelial tissue
W1-260,Tissues,Four Tissue Types,1,2,Where does epithelial tissue dominate?,"Epidermis, gut and vessel linings, and all glands.",epithelial tissue
W1-261,Tissues,Four Tissue Types,1,2,What is the primary function of connective tissue?,"Binds, supports, and protects.",connective tissue
W1-262,Tissues,Four Tissue Types,1,2,Where is connective tissue found?,"Throughout the body, between and within organs.",connective tissue
W1-263,Tissues,Four Tissue Types,1,2,What is the primary function of muscle tissue?,Produces movement by contracting.,muscle tissue
W1-264,Tissues,Four Tissue Types,1,2,Where is muscle tissue found?,"Skeletal muscles, heart wall, and walls of hollow organs.",muscle tissue
W1-265,Tissues,Four Tissue Types,1,2,What is the primary function of nervous tissue?,"Senses change, processes information, and directs responses.",nervous tissue
W1-266,Tissues,Four Tissue Types,1,2,Where is nervous tissue found?,"Brain, spinal cord, and nerves.",nervous tissue
W1-267,Tissues,Four Tissue Types,2,3,Compare epithelial and connective tissue by general role.,"Epithelial tissue covers and lines; connective tissue binds, supports, and protects.",epithelial; connective
W1-268,Tissues,Four Tissue Types,2,3,Compare muscle and nervous tissue by primary function.,"Muscle tissue contracts for movement; nervous tissue senses, processes, and directs responses.",muscle; nervous
W1-269,Tissues,Epithelial Tissue,1,2,What are the major functions of epithelial tissue?,"Protection, absorption, secretion, filtration, and sensory reception.",epithelial functions
W1-270,Tissues,Epithelial Tissue,1,2,What are general features of epithelial tissue?,"Tightly packed cells, little matrix, one free apical surface, avascular but innervated, high regeneration.",epithelial features
W1-271,Tissues,Epithelial Classification,1,2,How are epithelial tissues named?,By number of cell layers and shape of surface cells.,epithelial classification
W1-272,Tissues,Epithelial Classification,1,2,What is simple epithelium?,"One cell layer, built for absorption, secretion, and filtration.",simple epithelium
W1-273,Tissues,Epithelial Classification,1,2,What is stratified epithelium?,"Many cell layers, built for protection against wear.",stratified epithelium
W1-274,Tissues,Epithelial Classification,1,2,What are squamous cells?,"Flat, thin cells that allow rapid diffusion and filtration.",squamous cells
W1-275,Tissues,Epithelial Classification,1,2,What are cuboidal cells?,Cube-shaped cells common in glands and kidney tubules for secretion and absorption.,cuboidal cells
W1-276,Tissues,Epithelial Classification,1,2,What are columnar cells?,Tall cells lining absorptive and secretory surfaces such as the gut.,columnar cells
W1-277,Tissues,Epithelial Classification,1,2,What is pseudostratified epithelium?,"One layer that looks layered, often ciliated, lining the airways.",pseudostratified epithelium
W1-278,Tissues,Epithelial Classification,1,2,What is transitional epithelium?,"Epithelium that stretches and recoils, lining the urinary tract.",transitional epithelium
W1-279,Tissues,Epithelial Classification,2,3,Compare simple and stratified epithelium.,Simple has one layer for exchange/absorption/secretion; stratified has many layers for protection.,simple; stratified
W1-280,Tissues,Epithelial Classification,2,3,"Compare squamous, cuboidal, and columnar cells.",Squamous are flat; cuboidal are cube-shaped; columnar are tall.,cell shapes
W1-281,Tissues,Epithelial Classification,2,3,Why is stratified epithelium suited for protection?,Many layers resist wear and damage.,stratified epithelium
W1-282,Tissues,Epithelial Classification,2,3,Why is simple squamous epithelium suited for diffusion?,"Flat, thin cells create a short diffusion distance.",simple squamous
W1-283,Tissues,Epithelial Classification,3,4,A tissue must stretch and recoil in the urinary tract. Which epithelium fits?,Transitional epithelium.,transitional epithelium
W1-284,Tissues,Epithelial Classification,3,4,A ciliated airway lining looks layered but is one layer. Which epithelium fits?,Pseudostratified epithelium.,pseudostratified
W1-285,Tissues,Epithelial Classification,3,4,A gland duct is specialized for secretion and absorption. Which cell shape is common?,Cuboidal cells.,cuboidal
W1-286,Tissues,Epithelial Classification,3,4,An absorptive gut lining uses tall cells. Which epithelial shape fits?,Columnar cells.,columnar
W1-287,Tissues,Epithelial Structures,1,2,What is the basement membrane?,A thin sheet anchoring epithelium to underlying connective tissue.,basement membrane
W1-288,Tissues,Epithelial Structures,1,2,What two layers form the basement membrane?,Basal lamina and reticular lamina.,basement membrane
W1-289,Tissues,Epithelial Structures,1,2,What do apical microvilli do?,Increase surface area for absorption.,microvilli
W1-290,Tissues,Epithelial Structures,1,2,What do epithelial cilia do?,Sweep mucus and particles across the surface.,cilia
W1-291,Tissues,Epithelial Structures,2,3,Why is epithelium avascular but still alive?,It receives nutrients by diffusion from underlying connective tissue.,epithelial features
W1-292,Tissues,Epithelial Structures,2,3,Why does epithelium have high regenerative capacity?,It is exposed to wear and must replace damaged cells.,epithelial regeneration
W1-293,Tissues,Epithelial Structures,3,4,"If the basement membrane fails, what epithelial function is most directly compromised?",Anchoring epithelium to connective tissue below.,basement membrane; application
W1-294,Tissues,Epithelial Structures,3,4,"If airway cilia fail, what clinical problem becomes more likely?","Mucus and particles build up, increasing infection risk.",cilia; clinical
